{
  "version": 1,
  "record_id": "REV-2026-0001",
  "task_id": "fix-readme-link",
  "review_kind": "final",
  "lane": "fast",
  "subject": {"reference": "README.md", "sha256": "aaaaaaaaaaaaaaaaaaaaaaaaaaaaaaaaaaaaaaaaaaaaaaaaaaaaaaaaaaaaaaaa"},
  "dependencies": [],
  "reviewer": {"identity": "reviewer:example", "client": "adf-example", "level": "independent"},
  "raw_output_sha256": "bbbbbbbbbbbbbbbbbbbbbbbbbbbbbbbbbbbbbbbbbbbbbbbbbbbbbbbbbbbbbbbb",
  "outcome": "completed_pass",
  "findings": [],
  "lineage": {"prior_record_ids": [], "open_finding_ids": [], "resolved_finding_event_ids": []},
  "recorded_at": "2026-01-01T00:00:00Z"
}
