{
  "version": 1,
  "task_id": "add-invoice-status-index",
  "review_kind": "final",
  "lane": "high-risk",
  "subject": {
    "reference": "examples/contracts/high-risk.json",
    "sha256": "cccccccccccccccccccccccccccccccccccccccccccccccccccccccccccccccc"
  },
  "dependencies": [],
  "reviewer": {
    "identity": "reviewer:example",
    "client": "adf-example",
    "level": "independent"
  },
  "raw_output_sha256": "aaaaaaaaaaaaaaaaaaaaaaaaaaaaaaaaaaaaaaaaaaaaaaaaaaaaaaaaaaaaaaaa",
  "recorded_at": "2026-01-01T00:30:00Z",
  "record_id": "REV-2026-0005",
  "outcome": "completed_with_findings",
  "findings": [
    {
      "id": "FND-002",
      "severity": "advisory",
      "title": "Add an example",
      "detail": "A non-blocking documentation example would improve onboarding."
    }
  ],
  "lineage": {
    "prior_record_ids": [],
    "open_finding_ids": [],
    "resolved_finding_event_ids": []
  }
}
